{
  "$schema": "https://raw.githubusercontent.com/liangboqiang/TjuaeHub/main/schemas/tjuae-assistant.v1.schema.json",
  "format": "tjuae-assistant",
  "formatVersion": 1,
  "id": "story-roleplay",
  "version": "1.0.0",
  "name": "故事角色扮演",
  "nameI18n": {
    "en-US": "Story Roleplay",
    "zh-CN": "故事角色扮演",
    "ru-RU": "Ролевые истории",
    "uk-UA": "Рольові історії"
  },
  "description": "沉浸式故事角色扮演。三种开始方式：1) 自然语言直接对话创建角色，2) 直接粘贴PNG图片，3) 打开包含角色卡（PNG/JSON）和世界书的文件夹。",
  "descriptionI18n": {
    "en-US": "Immersive story roleplay. Start by: 1) Natural language to create characters, 2) Paste PNG images, or 3) Open folder with character cards (PNG/JSON) and world info.",
    "zh-CN": "沉浸式故事角色扮演。三种开始方式：1) 自然语言直接对话创建角色，2) 直接粘贴PNG图片，3) 打开包含角色卡（PNG/JSON）和世界书的文件夹。",
    "ru-RU": "Иммерсивный сюжетный ролевой режим. Можно начать тремя способами: описать персонажей словами, вставить PNG-изображения или открыть папку с карточками персонажей и лором мира.",
    "uk-UA": "Іммерсивний сюжетний рольовий режим. Можна почати трьома способами: описати персонажів словами, вставити PNG-зображення або відкрити папку з картками персонажів та лором світу."
  },
  "categories": [],
  "avatar": "assets/avatar.jpg",
  "instructions": {
    "default": "ASSISTANT.md",
    "locales": {
      "zh-CN": "ASSISTANT.md",
      "en-US": "rules/en-US.md",
      "ru-RU": "rules/ru-RU.md"
    }
  },
  "defaults": {
    "agent": "tjuaecli",
    "model": {
      "mode": "auto",
      "value": null
    },
    "permission": {
      "mode": "auto",
      "value": null
    },
    "thoughtLevel": {
      "mode": "auto",
      "value": null
    },
    "skills": [
      {
        "source": "tjuae-hub",
        "namespace": "official",
        "slug": "story-roleplay"
      }
    ],
    "mcps": []
  },
  "requirements": {
    "skills": [
      {
        "key": "skill-1",
        "required": true,
        "identity": {
          "source": "tjuae-hub",
          "namespace": "official",
          "slug": "story-roleplay"
        }
      }
    ],
    "mcps": [],
    "models": [],
    "agents": [
      {
        "key": "primary-agent",
        "required": true,
        "preferredAgentIds": ["tjuaecli"]
      }
    ]
  },
  "recommendedPrompts": [
    "开始一个勇敢战士的史诗奇幻冒险",
    "创建一个有背景故事和个性的详细角色",
    "在科幻设定中开始一个互动故事"
  ],
  "recommendedPromptsI18n": {
    "en-US": [
      "Start an epic fantasy adventure with a brave warrior",
      "Create a detailed character with backstory and personality",
      "Begin an interactive story in a sci-fi setting"
    ],
    "zh-CN": ["开始一个勇敢战士的史诗奇幻冒险", "创建一个有背景故事和个性的详细角色", "在科幻设定中开始一个互动故事"],
    "ru-RU": [
      "Начни эпическое фэнтези-приключение с отважным воином",
      "Создай детального персонажа с предысторией и характером",
      "Начни интерактивную историю в научно-фантастическом сеттинге"
    ],
    "uk-UA": [
      "Почати епічну фентезі-пригоду з хоробрим воїном",
      "Створити детального персонажа з історією та характером",
      "Почати інтерактивну історію в науково-фантастичному сетингу"
    ]
  },
  "contentHash": "sha256-493e0927791286d3bde2e4fa6d9c89c8a9ecc94c6358bff1c6db115f65deedd4",
  "extensions": {}
}
