{
  "$schema": "https://raw.githubusercontent.com/liangboqiang/TjuaeHub/main/schemas/tjuae-assistant.v1.schema.json",
  "format": "tjuae-assistant",
  "formatVersion": 1,
  "id": "ppt-creator",
  "version": "1.0.0",
  "name": "PPT 演示助手",
  "nameI18n": {
    "en-US": "PPT Creator",
    "zh-CN": "PPT 演示助手",
    "ru-RU": "Помощник PPT",
    "uk-UA": "Помічник PPT"
  },
  "description": "使用 内置文档工具 创建、编辑和分析专业 PPT 演示文稿。大胆设计、丰富版式、视觉冲击。",
  "descriptionI18n": {
    "en-US": "Create, edit, and analyze professional PowerPoint presentations with 内置文档工具. Bold designs, varied layouts, and visual impact.",
    "zh-CN": "使用 内置文档工具 创建、编辑和分析专业 PPT 演示文稿。大胆设计、丰富版式、视觉冲击。",
    "ru-RU": "Создаёт, редактирует и анализирует профессиональные презентации PowerPoint с помощью 内置文档工具: выразительный дизайн, разнообразные макеты и сильная визуальная подача.",
    "uk-UA": "Створюйте, редагуйте та аналізуйте професійні презентації PowerPoint за допомогою 内置文档工具: виразний дизайн, різноманітні макети та візуальний вплив."
  },
  "categories": [],
  "avatar": "assets/avatar.jpg",
  "instructions": {
    "default": "ASSISTANT.md",
    "locales": {
      "zh-CN": "ASSISTANT.md",
      "en-US": "rules/en-US.md",
      "ru-RU": "rules/ru-RU.md"
    }
  },
  "defaults": {
    "agent": "tjuaecli",
    "model": {
      "mode": "auto",
      "value": null
    },
    "permission": {
      "mode": "auto",
      "value": null
    },
    "thoughtLevel": {
      "mode": "auto",
      "value": null
    },
    "skills": [],
    "mcps": []
  },
  "requirements": {
    "skills": [],
    "mcps": [],
    "models": [],
    "agents": [
      {
        "key": "primary-agent",
        "required": true,
        "preferredAgentIds": ["tjuaecli"]
      }
    ]
  },
  "recommendedPrompts": [
    "做一份 10 页的 Kubernetes 迁移方案 PPT，包含架构对比、成本分析和迁移时间线",
    "做一份 10 页的 SaaS 产品数据看板 PPT，包含用户增长图表、转化漏斗和竞品分析",
    "做一份 10 页的金融科技产品路线图 PPT，包含用户增长趋势和投资分析"
  ],
  "recommendedPromptsI18n": {
    "en-US": [
      "Create a 10-slide Kubernetes migration proposal with architecture comparison, cost analysis, and migration timeline",
      "Create a 10-slide SaaS analytics dashboard for a project management tool with user growth charts, conversion funnel, and competitive landscape",
      "Create a 10-slide fintech product roadmap for a digital payment platform with user growth trajectory and investment analysis"
    ],
    "zh-CN": [
      "做一份 10 页的 Kubernetes 迁移方案 PPT，包含架构对比、成本分析和迁移时间线",
      "做一份 10 页的 SaaS 产品数据看板 PPT，包含用户增长图表、转化漏斗和竞品分析",
      "做一份 10 页的金融科技产品路线图 PPT，包含用户增长趋势和投资分析"
    ],
    "ru-RU": [
      "Создай презентацию на 10 слайдов о миграции в Kubernetes со сравнением архитектур, анализом затрат и графиком миграции",
      "Создай презентацию на 10 слайдов с аналитическим дашбордом для SaaS-инструмента управления проектами: графики роста пользователей, воронка конверсий и конкурентный ландшафт",
      "Создай презентацию на 10 слайдов с дорожной картой финтех-продукта для платформы цифровых платежей: траектория роста пользователей и инвестиционный анализ"
    ],
    "uk-UA": [
      "Створити презентацію на 10 слайдів щодо міграції на Kubernetes з порівнянням архітектур, аналізом витрат та графіком міграції",
      "Створити 10 слайдів дашборду аналітики SaaS для інструменту управління проектами з графіками росту користувачів та аналізом конкурентів",
      "Створити дорожню карту фінтех-продукту на 10 слайдів для платформи цифрових платежів з аналізом інвестицій"
    ]
  },
  "contentHash": "sha256-349af536e003641e576e25601209d971ee141566f56f342ae8cfc4e3f2a523b5",
  "extensions": {}
}
